"878D3K8I","journalArticle","2023","Wang, Zhenyang; Wang, Tongqing; Zhang, Lifei; Lu, Xinchun","Synthesis of CeO2 Nanoparticles Derived by Urea Condensation for Chemical Mechanical Polishing","Electronic Materials Letters","","1738-8090, 2093-6788","10.1007/s13391-023-00427-2","https://link.springer.com/10.1007/s13391-023-00427-2","The synthesis of C­ eO2 nanoparticles for C­ eO2 based slurry gains continuous emphasis on improving its performance in the chemical mechanical polishing of dielectric materials. Urea was selected to dominate the growth and morphology during the calcination process. Thermogravimetry experiments were used to analyze the the decomposition behavior. Particle morphology and size were analyzed. Crystalline phase information and surface valence were used to compare the differences in surface physical and chemical properties of ceria by different synthesis process. The C­ eO2 nanoparticles synthesized with urea were dispersed in water as slurry. The particle sizes of C­ eO2 were measured by dynamic light scattering. The Zeta potential of ­CeO2 dispersion were measured to show dispersing performance. The ­CeO2 nanoparticles synthesized with urea condensation show good monodisperse properties. The material removal rate of silicon oxide and surface quality after chemical mechanical polishing were selected to evaluate the chemical mechanical polishing performance. The ­CeO2 nanoparticles synthesized with urea condensation not only yielded better surface quality results than the commercial slurry but also showed a 153% (pH = 4) and 100% (pH = 10) increase in the material removal rate of silicon oxide compared to commercial.","2023-11","2024-03-12 03:10:04","2024-07-01 23:10:52","2024-03-12 03:10:04","580-587","","6","19","","Electron. Mater. Lett.","","","","","","","","en","","","","","DOI.org (Crossref)","","","","/Users/school/Zotero/storage/HKJ5PQTW/Wang et al. - 2023 - Synthesis of CeO2 Nanoparticles Derived by Urea Co.pdf","","synthesis; Exported; Highlighted_box","","","","","","","","","","","","","","","","","","","","","","","","","","","","","","","","","","","","","","","","","","","","","","",""
"KP98W9L7","journalArticle","2012","He, Hong-Wei; Wu, Xiao-Qing; Ren, Wei; Shi, Peng; Yao, Xi; Song, Zhi-Tang","Synthesis of crystalline cerium dioxide hydrosol by a sol–gel method","Ceramics International","","02728842","10.1016/j.ceramint.2011.05.063","https://linkinghub.elsevier.com/retrieve/pii/S0272884211004354","A nano-cerium dioxide hydrosol was synthesized via a sol–gel process at the range of room temperature to 65 8C with the nonionic surfactant PVP (polyvinylpyrrolidone). The mixture solution of cerium nitrate and urea turned out a visible chemical reaction under the catalysis of ammonia. The X-ray diffraction (XRD), transmission electron microscopy (TEM), and X-ray photoelectron spectroscopy (XPS) analyses indicated the colloidal ingredient and nano-crystal structural information. The colloid was crystalline face-centered cubic nano-structured cerium dioxide. The sizes of CeO2 colloids are in the range of several nanometers to 10 nm or more. The application of the hydrosol may focus on the ceria-based polishing agent for chemical mechanical polishing (CMP) process.","2012-01","2024-03-12 03:24:10","2024-07-01 23:10:52","2024-03-12 03:24:10","S501-S504","","","38","","Ceramics International","","","","","","","","en","","","","","DOI.org (Crossref)","","","","/Users/school/Zotero/storage/N7N55JJV/He et al. - 2012 - Synthesis of crystalline cerium dioxide hydrosol b.pdf","","synthesis; Exported; Highlighted_box","","","","","","","","","","","","","","","","","","","","","","","","","","","","","","","","","","","","","","","","","","","","","","",""
"VMKCR3H2","journalArticle","2023","Xu, Ning; Ma, Jiahui; Liu, Qi; Luo, Yuxin; Pu, Yongping","Preparation of CeO2 abrasives by reducing atmosphere-assisted molten salt method for enhancing their chemical mechanical polishing performance on SiO2 substrates","Journal of Rare Earths","","10020721","10.1016/j.jre.2022.10.011","https://linkinghub.elsevier.com/retrieve/pii/S100207212200312X","Ce3þ as the active site on the CeO2 abrasive surface is the key to enhancing the material removal rate (MRR). The CeO2 abrasives with high chemical activity were prepared by the molten salt method under a reducing atmosphere. The crystal structure and morphology of CeO2 abrasives were characterized by X-ray diffraction (XRD), scanning electron microscopy (SEM), transmission electron microscopy (TEM), Fourier transform infrared spectroscopy (FT-IR), ultravioletevisible diffuse reﬂectance spectroscopy (UVeVis DRS), and X-ray photoelectron spectroscopy (XPS). The CeO2 abrasives were obtained under different atmospheres (Air, Ar, and Ar/H2). With the enhancement of the reducing atmosphere, the morphology of the abrasives transforms from spherical to octahedral, while more oxygen vacancies and Ce3þ are generated on the surface of CeO2 abrasives. The CMP experiments show that the MRRs of the CeO2-Air, CeO2-Ar, and CeO2-Ar/H2 abrasives on SiO2 substrates are 337.60, 578.74, and 691.28 nm/min, respectively. Moreover, as conﬁrmed by atomic force microscopy (AFM), the substrate surfaces exhibit low roughness (~0.5 nm) after being polished using all of the prepared samples. Especially, the MRR of CeO2-Ar/H2 abrasives is increased by 104.76% compared with CeO2-air abrasives. The improved CMP performance is attributed to the increased Ce3þ concentration and the octahedral morphology of the abrasives enhancing the chemical reaction and mechanical removal at the abrasiveesubstrate interface.","2023-10","2024-03-12 03:29:55","2024-07-28 23:08:10","2024-03-12 03:29:55","1627-1635","","10","41","","Journal of Rare Earths","","","","","","","","en","","","","","DOI.org (Crossref)","","","","/Users/school/Zotero/storage/PRWQALZD/Xu et al. - 2023 - Preparation of CeO2 abrasives by reducing atmosphe.pdf","","synthesis; Exported; Highlighted_box","","","","","","","","","","","","","","","","","","","","","","","","","","","","","","","","","","","","","","","","","","","","","","",""
"HFTFYEKU","journalArticle","2004","Kang, Hyun-Goo; Katoh, Takeo; Kim, Sung-Jun; Paik, Ungyu; Park, Hyung-Soon; Park, Jea-Gun","Effects of Grain Size and Abrasive Size of Polycrystalline Nano-particle Ceria Slurry on Shallow Trench Isolation Chemical Mechanical Polishing","Japanese Journal of Applied Physics","","0021-4922","10.1143/JJAP.43.L365","https://iopscience.iop.org/article/10.1143/JJAP.43.L365","","2004-02-20","2024-03-12 03:35:23","2024-07-02 00:14:16","2024-03-12 03:35:23","L365-L368","","No. 3A","43","","Jpn. J. Appl. Phys.","","","","","","","","en","","","","","DOI.org (Crossref)","","","","/Users/school/Zotero/storage/CP35U8UK/Kang et al. - 2004 - Effects of Grain Size and Abrasive Size of Polycry.pdf","","synthesis; Exported; Highlighted_box; Solid","","","","","","","","","","","","","","","","","","","","","","","","","","","","","","","","","","","","","","","","","","","","","","",""
"IICS78CS","journalArticle","2015","Lekha Peedikakkandy; Peedikakkandy, Lekha; Laksheswar Kalita; Kalita, Laksheswar; Pravin Kavle; Kavle, Pravin; Ankur A. Kadam; Kadam, Ankur; Vikas Gujar; Gujar, Vikas; Mahesh Arcot; Arcot, Mahesh; Parag Bhargava; Bhargava, Parag","Preparation of spherical ceria coated silica nanoparticle abrasives for CMP application","Applied Surface Science","","","10.1016/j.apsusc.2015.09.149","","Abstract   This paper describes synthesis of spherical and highly mono-dispersed ceria coated silica nanoparticles of size ∼70–80nm for application as abrasive particles in Chemical Mechanical Planarization (CMP) process. Core silica nanoparticles were initially synthesized using micro-emulsion method. Ceria coating on these ultrafine and spherical silica nanoparticles was achieved using controlled chemical precipitation method. Study of various parameters influencing the formation of ceria coated silica nanoparticles of size less than 100nm has been undertaken and reported. Ceria coating over silica nanoparticles was varied by controlling the reaction temperature, pH and precursor concentrations. Characterization studies using X-ray diffraction, scanning electron microscopy, transmission electron microscopy and Energy Dispersive X-ray analysis show formation of crystalline CeO2 coating of ∼10nm thickness over silica with spherical morphology and particle size","2015-12-01","2024-03-25 19:11:10","2024-07-01 23:10:17","","1306-1312","","","357","","","","","","","","","","","","","","","","","DOI: 10.1016/j.apsusc.2015.09.149 MAG ID: 1699245060","","/Users/school/Zotero/storage/MEMJ32TJ/Lekha Peedikakkandy et al_2015_Preparation of spherical ceria coated silica nanoparticle abrasives for CMP.pdf","","synthesis; Exported; Highlighted_box","","","","","","","","","","","","","","","","","","","","","","","","","","","","","","","","","","","","","","","","","","","","","","",""
"7HATJ8G9","journalArticle","2006","Kim, Dae-Hyeong; Kang, Hyun-Goo; Kim, Sang-Kyun; Paik, Ungyu; Park, Jea-Gun","Effect of Calcination Process on Synthesis of Ceria Particles, and Its Influence on Shallow Trench Isolation Chemical Mechanical Planarization Performance","Japanese Journal of Applied Physics","","0021-4922, 1347-4065","10.1143/JJAP.45.4893","https://iopscience.iop.org/article/10.1143/JJAP.45.4893","","2006-06-01","2024-03-25 19:13:05","2024-07-02 00:09:44","2024-03-25 19:13:05","4893","","6R","45","","jjap","","","","","","","","en","","","","","DOI.org (Crossref)","","","","/Users/school/Zotero/storage/SCLSPYU6/Kim et al. - 2006 - Effect of Calcination Process on Synthesis of Ceri.pdf","","synthesis; Exported; Highlighted_box; Solid","","","","","","","","","","","","","","","","","","","","","","","","","","","","","","","","","","","","","","","","","","","","","","",""
"7H7P57KS","journalArticle","2002","Lee, Seung-Ho; Lu, Zhenyu; Babu, S. V.; Matijević, Egon","Chemical mechanical polishing of thermal oxide films using silica particles coated with ceria","Journal of Materials Research","","0884-2914, 2044-5326","10.1557/JMR.2002.0396","http://link.springer.com/10.1557/JMR.2002.0396","Thermal oxide covered silicon wafers were polished with slurries containing either nano-sized ceria (CeO               2               ) or newly prepared uniform colloidal silica particles coated with ceria. The polish rate of the latter was significantly higher than that of pure ceria. The experiments were carried out using different concentrations of the abrasives at pH 4 and 10. Little effect on the polishing rates was noted when the conditions of the slurries were varied, which was explained by the compensation of two opposite polishing mechanisms.","2002-10","2024-03-25 19:34:14","2024-07-01 23:10:11","2024-03-25 19:34:14","2744-2749","","10","17","","J. Mater. Res.","","","","","","","","en","https://www.cambridge.org/core/terms","","","","DOI.org (Crossref)","","","","/Users/school/Zotero/storage/GGKGFH3B/Lee et al. - 2002 - Chemical mechanical polishing of thermal oxide fil.pdf","","synthesis; Exported; Highlighted_box","","","","","","","","","","","","","","","","","","","","","","","","","","","","","","","","","","","","","","","","","","","","","","",""
"CADDDLWI","journalArticle","2005","Lim, D. S.; Ahn, J. W.; Park, H. S.; Shin, J. H.","The effect of CeO2 abrasive size on dishing and step height reduction of silicon oxide film in STI–CMP","Surface and Coatings Technology","","0257-8972","10.1016/j.surfcoat.2005.08.047","https://www.sciencedirect.com/science/article/pii/S0257897205008649","The effect of the CeO2 abrasive size during chemical mechanical polishing (CMP) of shallow trench isolation (STI) structures was investigated, in order to minimize the amount of oxide dishing and to improve the planarization efficiency. Three slurry samples were prepared based on a 1.0 wt.% abrasive concentration with different sizes of ceria particles. The step height and dishing reduction were investigated as a function of the polishing time with pattern wafers in prepared slurries. The reduction in thickness as a function of the polishing time varied between the different slurries. The dependence of the step height reduction of the patterned wafer on the polishing time showed non-linear behavior in all of the tested slurries. The amount of dishing also varied with the type of slurry. The changes in the cross-sectional profiles of the oxide as a function of the polishing time were analyzed, in order to establish a dishing and step height reduction model depending on the abrasive size. The step height variation and dishing were varied with the size of the abrasive. The observed results were explained by the contribution of inactive particles, which depended on relative size of the abrasives and the height of the remaining oxide layer.","2005-11-21","2024-03-25 19:49:45","2024-03-25 19:53:19","2024-03-25 19:49:45","1751-1754","","5","200","","Surface and Coatings Technology","","ICMCTF 2005","","","","","","","","","","","ScienceDirect","","","","/Users/school/Zotero/storage/4EX7PKWI/Lim et al_2005_The effect of CeO2 abrasive size on dishing and step height reduction of.pdf; /Users/school/Zotero/storage/RLXM3WCX/S0257897205008649.html","","","","","","","","","","","","","","","","","","","","","","","","","","","","","","","","","","","","","","","","","","","","","","","","",""
"YUHMEZW2","journalArticle","2007","Kim, Sang-Kyun; Kim, Ye-Hwan; Paik, Ungyu; Park, Jea-Gun","Influence of Crystalline Structure of Ceria on the Remaining Particles in the STI CMP","Journal of The Electrochemical Society","","00134651","10.1149/1.2735923","https://iopscience.iop.org/article/10.1149/1.2735923","","2007","2024-03-25 20:02:45","2024-07-01 23:10:17","2024-03-25 20:02:45","H642","","7","154","","J. Electrochem. Soc.","","","","","","","","en","","","","","DOI.org (Crossref)","","","","/Users/school/Zotero/storage/RT7BDIUB/Kim et al. - 2007 - Influence of Crystalline Structure of Ceria on the.pdf","","synthesis; Exported; Highlighted_box","","","","","","","","","","","","","","","","","","","","","","","","","","","","","","","","","","","","","","","","","","","","","","",""
"M6S4GUYU","bookSection","2016","Seo, J.; Paik, U.","Preparation and characterization of slurry for chemical mechanical planarization (CMP)","Advances in Chemical Mechanical Planarization (CMP)","978-0-08-100165-3","","","","","2016","2024-01-18 05:04:51","2024-09-06 23:55:27","2024-09-04 21:42:18","273-298","","","","","","","","","","","Elsevier","","en","https://www.elsevier.com/tdm/userlicense/1.0/","","","","DOI.org (Crossref)","","DOI: 10.1016/B978-0-08-100165-3.00011-5","","/Users/school/Zotero/storage/WFKQTYG6/Seo_Paik_2016_Preparation and characterization of slurry for chemical mechanical.pdf","","","","","","","","","","","","","","","","","","","","","","","","","","","","","","","","","","","","","","","","","","","","","","","","",""